<?xml version="1.0" encoding="UTF-8"?>
<Books xmlns:xsi="http://www.w3.org/2001/XMLSchema-instance" xsi:noNamespaceSchemaLocation="Books.xsd">
    <Book published="1894">
        <Title>The Jungle Book</Title>
        <Author>Rudiard Kipling</Author>
    </Book>
    <Book published="2003">
        <Title>The Da Vinci Code</Title>
        <Author>Dan Brown</Author>
    </Book>
    <Book published="1981">
        <Title>The name of the Rose</Title>
        <Author>Umberto Eco</Author>
    </Book>
    <Book published="1605">
        <Title>Don Quixote</Title>
        <Author>Cervantes</Author>
    </Book>
</Books>